--------------------------------
-- Ссылки
-----

@TODO: 

--------------------------------
-- Примеры
-----

-- Выводит список USB-устройств
$ lsusb
Bus 002 Device 013: ID 1bcf:0005 Sunplus Innovation Technology Inc. Optical Mouse
Bus 002 Device 010: ID 13fe:4100 Kingston Technology Company Inc. Flash drive
Bus 002 Device 006: ID 0a12:0001 Cambridge Silicon Radio, Ltd Bluetooth Dongle (HCI mode)
Bus 002 Device 004: ID 1a40:0101 Terminus Technology Inc. Hub
Bus 002 Device 014: ID 03f0:1841 Hewlett-Packard 
Bus 002 Device 002: ID 8087:0020 Intel Corp. Integrated Rate Matching Hub
Bus 002 Device 001: ID 1d6b:0002 Linux Foundation 2.0 root hub
Bus 001 Device 003: ID 03eb:9301 Atmel Corp. 
Bus 001 Device 002: ID 8087:0020 Intel Corp. Integrated Rate Matching Hub
Bus 001 Device 001: ID 1d6b:0002 Linux Foundation 2.0 root hub

-- Выводит информацию об USB-устройствах
$ usb-devices 

T:  Bus=01 Lev=00 Prnt=00 Port=00 Cnt=00 Dev#=  1 Spd=480 MxCh= 6
D:  Ver= 2.00 Cls=09(hub  ) Sub=00 Prot=00 MxPS=64 #Cfgs=  1
P:  Vendor=1d6b ProdID=0002 Rev=04.15
S:  Manufacturer=Linux 4.15.0-70-generic ehci_hcd
S:  Product=EHCI Host Controller
S:  SerialNumber=0000:00:1a.0
C:  #Ifs= 1 Cfg#= 1 Atr=e0 MxPwr=0mA
I:  If#= 0 Alt= 0 #EPs= 1 Cls=09(hub  ) Sub=00 Prot=00 Driver=hub

T:  Bus=01 Lev=01 Prnt=01 Port=00 Cnt=01 Dev#=  2 Spd=480 MxCh= 6
D:  Ver= 2.00 Cls=09(hub  ) Sub=00 Prot=01 MxPS=64 #Cfgs=  1
P:  Vendor=8087 ProdID=0020 Rev=00.00
C:  #Ifs= 1 Cfg#= 1 Atr=e0 MxPwr=0mA
I:  If#= 0 Alt= 0 #EPs= 1 Cls=09(hub  ) Sub=00 Prot=00 Driver=hub


--------------------------------
